{
  "$schema": "../../../schema/product.schema.json",
  "slug": "sistema-zberigannya-energii-deye-sun-10k-sg02lp1-eu-am3-3de1536k-lfp-10000w-1536kh-3bat-lifepo4-6000-tsikliv",
  "title": "Система зберігання енергії DEYE SUN-10K-SG02LP1-EU-AM3-3DE15.36K-LFP 10000W 15.36kh 3BAT LiFePO4 6000 циклів",
  "sourceUrl": "https://solarverse.ua/product/sistema-zberigannya-energii-deye-sun-10k-sg02lp1-eu-am3-3de1536k-lfp-10000w-1536kh-3bat-lifepo4-6000-tsikliv",
  "direction": "energy-solutions",
  "price": "205 428 грн · Ціну уточнюйте",
  "showPrice": true,
  "status": "consult",
  "shortDescription": "Готова система DEYE: потужність 10000 W, запас енергії 15.36 kWh, батарея LiFePO4.",
  "description": "Готова система зберігання енергії DEYE для резервного та автономного живлення. Конфігурація розрахована на номінальну потужність 10000 W і запас енергії 15.36 kWh. Перед замовленням уточнюємо актуальну ціну, наявність, комплектацію та сумісність із мережею об’єкта.",
  "specs": [
    {
      "label": "Бренд",
      "value": "DEYE"
    },
    {
      "label": "Сумарна енергія, що зберігається в блоку батарей",
      "value": "15.36 kWh"
    },
    {
      "label": "Номінальна потужність АС",
      "value": "10000 W"
    },
    {
      "label": "Сумарна ємність блоку батарей",
      "value": "300 Ah"
    },
    {
      "label": "Номінальна напруга батарей",
      "value": "51.2 V"
    },
    {
      "label": "Тип батареї",
      "value": "LiFePO4"
    },
    {
      "label": "Життевий цикл",
      "value": "6000 циклів"
    },
    {
      "label": "Тип",
      "value": "Гібридний"
    },
    {
      "label": "Кількість батарей",
      "value": "3"
    },
    {
      "label": "Кількість фаз",
      "value": "1"
    },
    {
      "label": "Кількість MPPT",
      "value": "3"
    },
    {
      "label": "Макс. вхідна потужність PV (сонячного масиву)",
      "value": "13 kW"
    },
    {
      "label": "Орієнтовний час до повного заряду стеку батарей",
      "value": "1.5 год"
    },
    {
      "label": "Гарантія",
      "value": "120 міс."
    }
  ],
  "compatibilityTitle": "Підходить для",
  "compatibility": [
    "резервного живлення приватних будинків і квартир",
    "офісів, магазинів та інших комерційних об’єктів",
    "інтеграції із сонячною генерацією після технічного розрахунку"
  ],
  "notice": "Ціна наведена довідково за даними джерела. Актуальну ціну, наявність і склад комплекту потрібно уточнити перед замовленням.",
  "image": "/images/products/solarverse/sistema-zberigannya-energii-deye-sun-10k-sg02lp1-eu-am3-3de1536k-lfp-10000w-1536kh-3bat-lifepo4-6000-tsikliv/1.webp",
  "images": [
    "/images/products/solarverse/sistema-zberigannya-energii-deye-sun-10k-sg02lp1-eu-am3-3de1536k-lfp-10000w-1536kh-3bat-lifepo4-6000-tsikliv/1.webp",
    "/images/products/solarverse/sistema-zberigannya-energii-deye-sun-10k-sg02lp1-eu-am3-3de1536k-lfp-10000w-1536kh-3bat-lifepo4-6000-tsikliv/2.webp",
    "/images/products/solarverse/sistema-zberigannya-energii-deye-sun-10k-sg02lp1-eu-am3-3de1536k-lfp-10000w-1536kh-3bat-lifepo4-6000-tsikliv/3.webp",
    "/images/products/solarverse/sistema-zberigannya-energii-deye-sun-10k-sg02lp1-eu-am3-3de1536k-lfp-10000w-1536kh-3bat-lifepo4-6000-tsikliv/4.webp",
    "/images/products/solarverse/sistema-zberigannya-energii-deye-sun-10k-sg02lp1-eu-am3-3de1536k-lfp-10000w-1536kh-3bat-lifepo4-6000-tsikliv/5.webp",
    "/images/products/solarverse/sistema-zberigannya-energii-deye-sun-10k-sg02lp1-eu-am3-3de1536k-lfp-10000w-1536kh-3bat-lifepo4-6000-tsikliv/6.webp"
  ],
  "featured": false,
  "source": "solarverse"
}
