{
  "$schema": "../../../schema/product.schema.json",
  "slug": "gibridniy-invertor-deye-sun-6k-sg03lp1-eu",
  "title": "Гібридний інвертор DEYE SUN-6K-SG03LP1-EU",
  "sourceUrl": "https://solarverse.ua/product/gibridniy-invertor-deye-sun-6k-sg03lp1-eu",
  "direction": "energy-solutions",
  "price": "Ціну уточнюйте",
  "showPrice": true,
  "status": "consult",
  "shortDescription": "інвертор Deye: 6000 W.",
  "description": "Гібридний інвертор DEYE SUN-6K-SG03LP1-EU. Характеристики наведені за даними джерела. Перед замовленням уточнюємо актуальну ціну, наявність, комплектацію, гарантію та сумісність з іншими компонентами системи.",
  "specs": [
    {
      "label": "Бренд",
      "value": "Deye"
    },
    {
      "label": "Виробник (бренд)",
      "value": "Deye"
    },
    {
      "label": "Тип",
      "value": "Гібридний"
    },
    {
      "label": "Номінальна потужність",
      "value": "6000 W"
    },
    {
      "label": "Вихідна напруга АКБ",
      "value": "48 V"
    },
    {
      "label": "Гарантія",
      "value": "120 міс."
    }
  ],
  "compatibilityTitle": "Підходить для",
  "compatibility": [
    "сонячних електростанцій і систем резервного живлення",
    "приватних та комерційних об’єктів після розрахунку навантаження",
    "сумісних акумуляторних систем відповідної напруги"
  ],
  "notice": "Ціна наведена довідково за даними джерела. Актуальну ціну, наявність і сумісність потрібно уточнити перед замовленням.",
  "image": "/images/products/solarverse/equipment/inverters/gibridniy-invertor-deye-sun-6k-sg03lp1-eu/1.webp",
  "images": [
    "/images/products/solarverse/equipment/inverters/gibridniy-invertor-deye-sun-6k-sg03lp1-eu/1.webp",
    "/images/products/solarverse/equipment/inverters/gibridniy-invertor-deye-sun-6k-sg03lp1-eu/2.webp",
    "/images/products/solarverse/equipment/inverters/gibridniy-invertor-deye-sun-6k-sg03lp1-eu/3.webp",
    "/images/products/solarverse/equipment/inverters/gibridniy-invertor-deye-sun-6k-sg03lp1-eu/4.webp",
    "/images/products/solarverse/equipment/inverters/gibridniy-invertor-deye-sun-6k-sg03lp1-eu/5.webp"
  ],
  "featured": false,
  "source": "solarverse"
}
