{
  "$schema": "../../../schema/product.schema.json",
  "slug": "sistema-zberigannya-energii-solarverse-sv5048upsr-1gs48k-lfp-5-48kwh-1bat-lifepo4-6500-tsikliv",
  "title": "Система зберігання енергії Solarverse SV5048UPSR-1GS4.8K-LFP 5 4.8kWh 1BAT LiFePO4 6500 циклів",
  "sourceUrl": "https://solarverse.ua/product/sistema-zberigannya-energii-solarverse-sv5048upsr-1gs48k-lfp-5-48kwh-1bat-lifepo4-6500-tsikliv",
  "direction": "energy-solutions",
  "price": "76 998 грн · Ціну уточнюйте",
  "showPrice": true,
  "status": "consult",
  "shortDescription": "Готова система Solarverse: потужність 5000 W, запас енергії 4.8 kWh, батарея LiFePO4.",
  "description": "Готова система зберігання енергії Solarverse для резервного та автономного живлення. Конфігурація розрахована на номінальну потужність 5000 W і запас енергії 4.8 kWh. Перед замовленням уточнюємо актуальну ціну, наявність, комплектацію та сумісність із мережею об’єкта.",
  "specs": [
    {
      "label": "Бренд",
      "value": "Solarverse"
    },
    {
      "label": "Сумарна енергія, що зберігається в блоку батарей",
      "value": "4.8 kWh"
    },
    {
      "label": "Номінальна потужність АС",
      "value": "5000 W"
    },
    {
      "label": "Сумарна ємність блоку батарей",
      "value": "100 Ah"
    },
    {
      "label": "Номінальна напруга батарей",
      "value": "48 V"
    },
    {
      "label": "Тип батареї",
      "value": "LiFePO4"
    },
    {
      "label": "Життевий цикл",
      "value": "6500 циклів"
    },
    {
      "label": "Тип",
      "value": "Автономний"
    },
    {
      "label": "Кількість батарей",
      "value": "1"
    },
    {
      "label": "Кількість фаз",
      "value": "1"
    },
    {
      "label": "Кількість MPPT",
      "value": "1"
    },
    {
      "label": "Макс. вхідна потужність PV (сонячного масиву)",
      "value": "4 kW"
    },
    {
      "label": "Орієнтовний час до повного заряду стеку батарей",
      "value": "1.1 год"
    },
    {
      "label": "Гарантія",
      "value": "36 міс."
    }
  ],
  "compatibilityTitle": "Підходить для",
  "compatibility": [
    "резервного живлення приватних будинків і квартир",
    "офісів, магазинів та інших комерційних об’єктів",
    "інтеграції із сонячною генерацією після технічного розрахунку"
  ],
  "notice": "Ціна наведена довідково за даними джерела. Актуальну ціну, наявність і склад комплекту потрібно уточнити перед замовленням.",
  "image": "/images/products/solarverse/sistema-zberigannya-energii-solarverse-sv5048upsr-1gs48k-lfp-5-48kwh-1bat-lifepo4-6500-tsikliv/1.webp",
  "images": [
    "/images/products/solarverse/sistema-zberigannya-energii-solarverse-sv5048upsr-1gs48k-lfp-5-48kwh-1bat-lifepo4-6500-tsikliv/1.webp",
    "/images/products/solarverse/sistema-zberigannya-energii-solarverse-sv5048upsr-1gs48k-lfp-5-48kwh-1bat-lifepo4-6500-tsikliv/2.webp",
    "/images/products/solarverse/sistema-zberigannya-energii-solarverse-sv5048upsr-1gs48k-lfp-5-48kwh-1bat-lifepo4-6500-tsikliv/3.webp",
    "/images/products/solarverse/sistema-zberigannya-energii-solarverse-sv5048upsr-1gs48k-lfp-5-48kwh-1bat-lifepo4-6500-tsikliv/4.webp",
    "/images/products/solarverse/sistema-zberigannya-energii-solarverse-sv5048upsr-1gs48k-lfp-5-48kwh-1bat-lifepo4-6500-tsikliv/5.webp"
  ],
  "featured": false,
  "source": "solarverse"
}
