{
  "$schema": "../../../schema/product.schema.json",
  "slug": "kopiya-hibrydnyy-invertor-livoltek-hp3-12kd2",
  "legacySlugs": [
    "копія-гібридний-інвертор-livoltek-hp3-12kd2"
  ],
  "title": "Гібридний інвертор Livoltek HP3-12KD2 (12 кВт)",
  "sourceUrl": "https://www.namato.net/product-page/копія-гібридний-інвертор-livoltek-hp3-12kd2",
  "direction": "energy-solutions",
  "price": "57 915 грн · Ціну уточнюйте",
  "showPrice": true,
  "status": "consult",
  "shortDescription": "інвертор Livoltek, модель HP3-12KD2.",
  "description": "Гібридний інвертор Livoltek HP3-12KD2 (12 кВт) — інвертор для комплектації енергосистеми відповідно до параметрів об’єкта.\n\nОсновні характеристики:\n• Бренд: Livoltek\n• Модель: HP3-12KD2\n• Тип: Гібридний\n• Номінальна потужність: 12 кВт\n• Кількість фаз: 3\n\nПеред замовленням уточнюємо актуальну ціну, наявність, комплектацію, гарантію та сумісність з іншими компонентами системи.",
  "specs": [
    {
      "label": "Бренд",
      "value": "Livoltek"
    },
    {
      "label": "Модель",
      "value": "HP3-12KD2"
    },
    {
      "label": "Тип",
      "value": "Гібридний"
    },
    {
      "label": "Номінальна потужність",
      "value": "12 кВт"
    },
    {
      "label": "Кількість фаз",
      "value": "3"
    },
    {
      "label": "Ступінь захисту від вологи та пилу",
      "value": "IP65"
    }
  ],
  "compatibilityTitle": "Підходить для",
  "compatibility": [
    "сонячних електростанцій і систем резервного живлення",
    "приватних та комерційних об’єктів після розрахунку навантаження",
    "сумісних акумуляторних систем відповідної напруги"
  ],
  "notice": "Ціна наведена довідково. Актуальну ціну, наявність, комплектацію, гарантію та сумісність потрібно уточнити перед замовленням.",
  "image": "/images/products/namato/копія-гібридний-інвертор-livoltek-hp3-12kd2/1.webp",
  "images": [
    "/images/products/namato/копія-гібридний-інвертор-livoltek-hp3-12kd2/1.webp",
    "/images/products/namato/копія-гібридний-інвертор-livoltek-hp3-12kd2/2.webp",
    "/images/products/namato/копія-гібридний-інвертор-livoltek-hp3-12kd2/3.webp",
    "/images/products/namato/копія-гібридний-інвертор-livoltek-hp3-12kd2/4.webp",
    "/images/products/namato/копія-гібридний-інвертор-livoltek-hp3-12kd2/5.webp"
  ],
  "featured": false,
  "source": "namato"
}
