{
  "$schema": "../../../schema/product.schema.json",
  "slug": "sistema-khraneniya-energii-solarverse-sv-1sv6k2-les102k1-6kw-102kwh-2bat-lifepo4-6000-tsiklov-sv-1sv6k2-les102k1",
  "title": "Система зберігання енергії Solarverse SV-1SV6K2-LES10.2K1 6kW 10.2kWh 2BAT LiFePO4 6000 циклів (SV-1SV6K2-LES10.2K1)",
  "sourceUrl": "https://solarverse.ua/product/sistema-khraneniya-energii-solarverse-sv-1sv6k2-les102k1-6kw-102kwh-2bat-lifepo4-6000-tsiklov-sv-1sv6k2-les102k1",
  "direction": "energy-solutions",
  "price": "Ціну уточнюйте",
  "showPrice": true,
  "status": "consult",
  "shortDescription": "Готова система Solarverse: потужність 6000 W, запас енергії 10.24 kWh, батарея LiFePO4.",
  "description": "Готова система зберігання енергії Solarverse для резервного та автономного живлення. Конфігурація розрахована на номінальну потужність 6000 W і запас енергії 10.24 kWh. Перед замовленням уточнюємо актуальну ціну, наявність, комплектацію та сумісність із мережею об’єкта.",
  "specs": [
    {
      "label": "Бренд",
      "value": "Solarverse"
    },
    {
      "label": "Сумарна енергія, що зберігається в блоку батарей",
      "value": "10.24 kWh"
    },
    {
      "label": "Номінальна потужність АС",
      "value": "6000 W"
    },
    {
      "label": "Сумарна ємність блоку батарей",
      "value": "200 Ah"
    },
    {
      "label": "Номінальна напруга батарей",
      "value": "51.2 V"
    },
    {
      "label": "Тип батареї",
      "value": "LiFePO4"
    },
    {
      "label": "Життевий цикл",
      "value": "6000 циклів"
    },
    {
      "label": "Тип",
      "value": "Автономний"
    },
    {
      "label": "Кількість батарей",
      "value": "2"
    },
    {
      "label": "Кількість фаз",
      "value": "1"
    },
    {
      "label": "Кількість MPPT",
      "value": "1"
    },
    {
      "label": "Макс. вхідна потужність PV (сонячного масиву)",
      "value": "6 kW"
    },
    {
      "label": "Орієнтовний час до повного заряду стеку батарей",
      "value": "1.9 год"
    },
    {
      "label": "Гарантія",
      "value": "60 міс."
    }
  ],
  "compatibilityTitle": "Підходить для",
  "compatibility": [
    "резервного живлення приватних будинків і квартир",
    "офісів, магазинів та інших комерційних об’єктів",
    "інтеграції із сонячною генерацією після технічного розрахунку"
  ],
  "notice": "Ціна наведена довідково за даними джерела. Актуальну ціну, наявність і склад комплекту потрібно уточнити перед замовленням.",
  "image": "/images/products/solarverse/sistema-khraneniya-energii-solarverse-sv-1sv6k2-les102k1-6kw-102kwh-2bat-lifepo4-6000-tsiklov-sv-1sv6k2-les102k1/1.webp",
  "images": [
    "/images/products/solarverse/sistema-khraneniya-energii-solarverse-sv-1sv6k2-les102k1-6kw-102kwh-2bat-lifepo4-6000-tsiklov-sv-1sv6k2-les102k1/1.webp",
    "/images/products/solarverse/sistema-khraneniya-energii-solarverse-sv-1sv6k2-les102k1-6kw-102kwh-2bat-lifepo4-6000-tsiklov-sv-1sv6k2-les102k1/2.webp",
    "/images/products/solarverse/sistema-khraneniya-energii-solarverse-sv-1sv6k2-les102k1-6kw-102kwh-2bat-lifepo4-6000-tsiklov-sv-1sv6k2-les102k1/3.webp",
    "/images/products/solarverse/sistema-khraneniya-energii-solarverse-sv-1sv6k2-les102k1-6kw-102kwh-2bat-lifepo4-6000-tsiklov-sv-1sv6k2-les102k1/4.webp",
    "/images/products/solarverse/sistema-khraneniya-energii-solarverse-sv-1sv6k2-les102k1-6kw-102kwh-2bat-lifepo4-6000-tsiklov-sv-1sv6k2-les102k1/5.webp"
  ],
  "featured": false,
  "source": "solarverse"
}
