{
  "$schema": "../../../schema/product.schema.json",
  "slug": "hibrydnyy-invertor-deye-5-kvt-sun-5k-sg03lp1-eu",
  "legacySlugs": [
    "гібридний-інвертор-deye-5-квт-sun-5k-sg03lp1-eu"
  ],
  "title": "Гібридний інвертор Deye 5 кВт SUN-5K-SG05LP1-EU",
  "sourceUrl": "https://www.namato.net/product-page/гібридний-інвертор-deye-5-квт-sun-5k-sg03lp1-eu",
  "direction": "energy-solutions",
  "price": "35 100 грн · Ціну уточнюйте",
  "showPrice": true,
  "status": "consult",
  "shortDescription": "інвертор Deye, модель SUN-5K-SG03LP1-EU.",
  "description": "Гібридний інвертор Deye 5 кВт SUN-5K-SG05LP1-EU — інвертор для комплектації енергосистеми відповідно до параметрів об’єкта.\n\nОсновні характеристики:\n• Бренд: Deye\n• Модель: SUN-5K-SG03LP1-EU\n• Тип: Гібридний\n• Номінальна потужність: 5 кВт\n• Кількість фаз: 1\n\nПеред замовленням уточнюємо актуальну ціну, наявність, комплектацію, гарантію та сумісність з іншими компонентами системи.",
  "specs": [
    {
      "label": "Бренд",
      "value": "Deye"
    },
    {
      "label": "Модель",
      "value": "SUN-5K-SG03LP1-EU"
    },
    {
      "label": "Тип",
      "value": "Гібридний"
    },
    {
      "label": "Номінальна потужність",
      "value": "5 кВт"
    },
    {
      "label": "Кількість фаз",
      "value": "1"
    },
    {
      "label": "Ступінь захисту від вологи та пилу",
      "value": "IP65"
    }
  ],
  "compatibilityTitle": "Підходить для",
  "compatibility": [
    "сонячних електростанцій і систем резервного живлення",
    "приватних та комерційних об’єктів після розрахунку навантаження",
    "сумісних акумуляторних систем відповідної напруги"
  ],
  "notice": "Ціна наведена довідково. Актуальну ціну, наявність, комплектацію, гарантію та сумісність потрібно уточнити перед замовленням.",
  "image": "/images/products/namato/гібридний-інвертор-deye-5-квт-sun-5k-sg03lp1-eu/1.webp",
  "images": [
    "/images/products/namato/гібридний-інвертор-deye-5-квт-sun-5k-sg03lp1-eu/1.webp",
    "/images/products/namato/гібридний-інвертор-deye-5-квт-sun-5k-sg03lp1-eu/2.webp",
    "/images/products/namato/гібридний-інвертор-deye-5-квт-sun-5k-sg03lp1-eu/3.webp"
  ],
  "featured": false,
  "source": "namato"
}
