{
  "$schema": "../../../schema/product.schema.json",
  "slug": "saft-ls14500-04224x",
  "title": "Батарейка Saft LS14500 3,6 V AA (04224X)",
  "sourceUrl": "https://www.rcscomponents.kiev.ua/product/batareika-aa-litiieva-3-6v-1sht-saft-ls14500-04224x_31990.html",
  "direction": "metering-and-comfort",
  "price": "від 122 грн · Ціну уточнюйте",
  "showPrice": true,
  "status": "in-stock",
  "shortDescription": "Стандартна літієва батарейка Saft LS14500 формату AA, Li-SOCl₂ 3,6 V / 2600 мА·год, без виводів (кнопковий контакт).",
  "description": "Saft LS14500 (код 04224X) — первинний елемент Li-SOCl₂ формату AA / ER14505 без додаткових виводів (стандартний позитивний «кнопковий» контакт). Напруга 3,6 V, ємність 2600 мА·год, робоча температура −60…+85 °C, максимальний довготривалий струм навантаження близько 50 мА.\n\nПідходить для лічильників і промислових пристроїв, де елемент встановлюється в тримач без пайки. Для монтажу під пайку дивіться виконання CNA / CNR.\n\nЗа даними джерела є оптові ціни від 1 до 1000+ шт. Перед замовленням уточнюємо актуальну ціну з ПДВ/без ПДВ і наявність на складі.",
  "specs": [
    { "label": "Бренд", "value": "Saft" },
    { "label": "Модель / код", "value": "LS14500 | 04224X" },
    { "label": "Хімія", "value": "Li-SOCl₂" },
    { "label": "Типорозмір", "value": "AA / ER14505" },
    { "label": "Напруга", "value": "3,6 V" },
    { "label": "Ємність", "value": "2600 мА·год" },
    { "label": "Виводи", "value": "Без виводів (кнопковий контакт)" },
    { "label": "Макс. довготривалий струм", "value": "50 мА" },
    { "label": "Робоча температура", "value": "−60…+85 °C" },
    { "label": "Форма", "value": "Циліндрична" },
    { "label": "Код товару постачальника", "value": "31990" }
  ],
  "configurations": [
    { "label": "від 1 шт.", "equipment": ["LS14500 04224X"], "price": "170 грн (без ПДВ)" },
    { "label": "від 10 шт.", "equipment": ["LS14500 04224X"], "price": "155 грн (без ПДВ)" },
    { "label": "від 100 шт.", "equipment": ["LS14500 04224X"], "price": "134 грн (без ПДВ)" },
    { "label": "від 1000 шт.", "equipment": ["LS14500 04224X"], "price": "122 грн (без ПДВ)" }
  ],
  "compatibilityTitle": "Підходить для",
  "compatibility": [
    "лічильників тепла, води та газу з тримачем AA 3,6 V",
    "модулів обліку без пайки елемента",
    "заміни стандартного LS14500 без виводів"
  ],
  "notice": "Ціни на джерелі вказані без ПДВ. Первинна батарейка — не заряджати. Перед заміною звіряйте модель і полярність.",
  "image": "/images/products/lithium/saft-ls14500-04224x/1.webp",
  "images": [
    "/images/products/lithium/saft-ls14500-04224x/1.webp"
  ],
  "featured": true,
  "source": "manual"
}
