{
  "$schema": "../../../schema/product.schema.json",
  "slug": "komplekt-rezervnoho-zhyvlennya-invertor-8-kvt-akb-10-kvt-hod",
  "legacySlugs": [
    "комплект-резервного-живлення-інвертор-8-квт-акб-10-квт-год"
  ],
  "title": "Джерело безперебійного живлення Deye 8 кВт + АКБ 10 кВт/год",
  "sourceUrl": "https://www.namato.net/product-page/комплект-резервного-живлення-інвертор-8-квт-акб-10-квт-год",
  "direction": "energy-solutions",
  "price": "120 200 грн · Ціну уточнюйте",
  "showPrice": true,
  "status": "consult",
  "shortDescription": "комплект резервного живлення Deye, модель інвертор 8 кВт + АКБ 10 кВт/год.",
  "description": "Джерело безперебійного живлення Deye 8 кВт + АКБ 10 кВт/год — комплект резервного живлення для комплектації енергосистеми відповідно до параметрів об’єкта.\n\nОсновні характеристики:\n• Бренд: Deye\n• Модель: інвертор 8 кВт + АКБ 10 кВт/год\n• Потужність інвертора: 8 кВт\n• Запас енергії батарей: 10 кВт·год\n\nПеред замовленням уточнюємо актуальну ціну, наявність, комплектацію, гарантію та сумісність з іншими компонентами системи.",
  "specs": [
    {
      "label": "Бренд",
      "value": "Deye"
    },
    {
      "label": "Модель",
      "value": "інвертор 8 кВт + АКБ 10 кВт/год"
    },
    {
      "label": "Потужність інвертора",
      "value": "8 кВт"
    },
    {
      "label": "Запас енергії батарей",
      "value": "10 кВт·год"
    }
  ],
  "compatibilityTitle": "Підходить для",
  "compatibility": [
    "резервного живлення будинку, офісу або невеликого бізнесу",
    "критичних навантажень після розрахунку їхньої потужності",
    "подальшого масштабування після перевірки конфігурації"
  ],
  "notice": "Ціна наведена довідково. Актуальну ціну, наявність, комплектацію, гарантію та сумісність потрібно уточнити перед замовленням.",
  "image": "/images/products/namato/комплект-резервного-живлення-інвертор-8-квт-акб-10-квт-год/1.webp",
  "images": [
    "/images/products/namato/комплект-резервного-живлення-інвертор-8-квт-акб-10-квт-год/1.webp"
  ],
  "featured": false,
  "source": "namato"
}
