{
  "$schema": "../../../schema/product.schema.json",
  "slug": "sonyachna-panel-longi-lr7-72hvn-650m",
  "legacySlugs": [
    "сонячна-панель-longi-lr7-72hvн-650m"
  ],
  "title": "Сонячна панель Longi LR7-72HVН-650M",
  "sourceUrl": "https://www.namato.net/product-page/сонячна-панель-longi-lr7-72hvн-650m",
  "direction": "energy-solutions",
  "price": "5 270 грн · Ціну уточнюйте",
  "showPrice": true,
  "status": "consult",
  "shortDescription": "сонячна панель Longi, модель 72HVН.",
  "description": "Сонячна панель Longi LR7-72HVН-650M — сонячна панель для комплектації енергосистеми відповідно до параметрів об’єкта.\n\nОсновні характеристики:\n• Бренд: Longi\n• Модель: 72HVН\n• Тип панелі: Монокристалічна\n• Номінальна напруга: 1500 В DC\n• Ступінь захисту від вологи та пилу: IP68\n\nПеред замовленням уточнюємо актуальну ціну, наявність, комплектацію, гарантію та сумісність з іншими компонентами системи.",
  "specs": [
    {
      "label": "Бренд",
      "value": "Longi"
    },
    {
      "label": "Модель",
      "value": "72HVН"
    },
    {
      "label": "Тип панелі",
      "value": "Монокристалічна"
    },
    {
      "label": "Номінальна напруга",
      "value": "1500 В DC"
    },
    {
      "label": "Ступінь захисту від вологи та пилу",
      "value": "IP68"
    },
    {
      "label": "Гарантія",
      "value": "15 років"
    }
  ],
  "compatibilityTitle": "Підходить для",
  "compatibility": [
    "дахових і наземних сонячних електростанцій",
    "мережевих, гібридних та автономних систем",
    "приватних і комерційних об’єктів після проєктного розрахунку"
  ],
  "notice": "Ціна наведена довідково. Актуальну ціну, наявність, комплектацію, гарантію та сумісність потрібно уточнити перед замовленням.",
  "image": "/images/products/namato/сонячна-панель-longi-lr7-72hvн-650m/1.webp",
  "images": [
    "/images/products/namato/сонячна-панель-longi-lr7-72hvн-650m/1.webp"
  ],
  "featured": false,
  "source": "namato"
}
